{
  "id": "011-bronchiectasis-demonstrator",
  "title": "Bronchiectasis rare-aetiology demonstrator",
  "status": "blocked",
  "priority": "must",
  "created": "2026-07-19",
  "updated": "2026-08-16",
  "target_release": "0.6.0",
  "stage": "reference_analysis",
  "owner_role": "Respiratory Clinical and Epidemiology Leads",
  "dependencies": [
    "008-semantic-backbone",
    "009-evidence-parameter-ledger",
    "010-public-burden-engine"
  ],
  "review_gates": [
    "scientific",
    "patient_community",
    "engineering"
  ],
  "v1_critical": true
}
