{
  "id": "011-bronchiectasis-demonstrator",
  "title": "Bronchiectasis rare-aetiology demonstrator",
  "status": "complete",
  "priority": "must",
  "created": "2026-07-19",
  "updated": "2026-09-12",
  "target_release": "0.6.0",
  "stage": "real_public_aggregate_supplement",
  "owner_role": "Repository owner (sole accountable human)",
  "dependencies": [
    "008-semantic-backbone",
    "009-evidence-parameter-ledger",
    "010-public-burden-engine"
  ],
  "review_gates": [
    "scientific",
    "patient_community",
    "engineering"
  ],
  "v1_critical": true
}
