{
  "id": "004-federated-node-runner",
  "title": "Federated country-node execution package",
  "status": "blocked",
  "priority": "must",
  "created": "2026-07-19",
  "updated": "2026-09-06",
  "target_release": "0.6.0",
  "stage": "federated_execution",
  "owner_role": "Repository owner (sole accountable human)",
  "dependencies": [
    "006-v1-delivery-system",
    "009-evidence-parameter-ledger",
    "010-public-burden-engine"
  ],
  "review_gates": [
    "data_governance",
    "patient_community",
    "engineering",
    "security"
  ],
  "v1_critical": true
}
