{
  "id": "015-governance-partnership-policy",
  "title": "Operational governance, partnerships and policy translation",
  "status": "complete",
  "priority": "must",
  "created": "2026-07-19",
  "updated": "2026-08-21",
  "target_release": "0.9.0",
  "stage": "governance_and_translation",
  "owner_role": "Repository owner (sole accountable human)",
  "dependencies": [
    "006-v1-delivery-system",
    "007-landscape-novelty",
    "013-quality-validation-gap-equity"
  ],
  "review_gates": [
    "patient_community",
    "scientific",
    "data_governance",
    "programme",
    "release"
  ],
  "v1_critical": true
}
