{
  "id": "012-paediatric-burden-demonstrator",
  "title": "Collective paediatric rare-disease burden demonstrator",
  "status": "blocked",
  "priority": "must",
  "created": "2026-07-19",
  "updated": "2026-08-16",
  "target_release": "0.7.0",
  "stage": "controlled_reference_analysis",
  "owner_role": "Paediatric, Administrative Data and Health Economics Leads",
  "dependencies": [
    "004-federated-node-runner",
    "005-economic-social-burden",
    "008-semantic-backbone",
    "009-evidence-parameter-ledger",
    "010-public-burden-engine"
  ],
  "review_gates": [
    "scientific",
    "patient_community",
    "data_governance",
    "engineering",
    "security"
  ],
  "v1_critical": true
}
