{
  "id": "017-documentation-adoption-v1",
  "title": "Documentation, adoption, sustainability and stable v1 release",
  "status": "complete",
  "priority": "must",
  "created": "2026-07-19",
  "updated": "2026-09-06",
  "target_release": "1.0.0",
  "stage": "stable_release",
  "owner_role": "Repository owner (sole accountable human)",
  "dependencies": [
    "013-quality-validation-gap-equity",
    "014-atlas-api-release",
    "015-governance-partnership-policy",
    "016-security-reliability-operations"
  ],
  "review_gates": [
    "scientific",
    "patient_community",
    "data_governance",
    "engineering",
    "security",
    "programme",
    "release"
  ],
  "v1_critical": true
}
